{
  "schema_version": 2,
  "derivation_id": "DV-018fa2b3-12cd-7abc-8abc-0123456789ab",
  "parent_uri": "brain://evidence/EV-018fa2b3-12cd-7abc-8abc-0123456789ab",
  "output_uri": "brain://artifact/AR-018fa2b3-12cd-7abc-8abc-0123456789ab",
  "transform_type": "text-extraction",
  "tool": {
    "name": "test-tool",
    "version": "0.0"
  },
  "created_at": "2026-10-09T20:43:00+09:00",
  "output_sha256": "5d000b44db178b31c4aca20a5ef5741adb7e14b8297a2139e83f4119c783dd5f",
  "actor": "human:fixture"
}
